{
  "acceptance_evidence": [
    "Git commit and push successful"
  ],
  "artifacts": [
    {
      "path": "report.md",
      "purpose": "worker report",
      "sha256": "b59233fa217314b931c2ceee4d77c4fe794f8c9aefb150a9966407090400389e"
    },
    {
      "path": "checkpoint.md",
      "purpose": "current checkpoint",
      "sha256": "8c4e73dc3e723d0124a59d8f17199fda6b944307046bdc84af0bd9af0befc90a"
    },
    {
      "path": "progress.json",
      "purpose": "machine-readable progress",
      "sha256": "8fb681157d2c3affe49e7de15b29bca16ab533f5ce82c81572d0bcf7f308bee0"
    }
  ],
  "blocking_issues": [],
  "checkpoint_sha256": "8c4e73dc3e723d0124a59d8f17199fda6b944307046bdc84af0bd9af0befc90a",
  "completed_work_units": [
    "commit"
  ],
  "created_at": "2026-07-09T20:34:54.982873Z",
  "dispatch_id": "DSP-25e5fc41da0ac5e5992a",
  "improvement_observations": [],
  "nonce": "NONCE-3af706a90a7b7df16ea7",
  "proposed_jobs": [],
  "schema_version": 3,
  "status": "completed",
  "summary": "Changes committed and pushed"
}
