{
  "acceptance_evidence": [
    "Temperature-to-color in shader, non-linear flash, scrubbing pauses simulation"
  ],
  "artifacts": [
    {
      "path": "report.md",
      "purpose": "worker report",
      "sha256": "b59233fa217314b931c2ceee4d77c4fe794f8c9aefb150a9966407090400389e"
    },
    {
      "path": "checkpoint.md",
      "purpose": "current checkpoint",
      "sha256": "defecae9ced71607eddedd2632c1f991bce73cd5ac70edf5b111804a0bc468d8"
    },
    {
      "path": "progress.json",
      "purpose": "machine-readable progress",
      "sha256": "368105cbbebfc2dd2622fa0eeab71f5555593251305be5922642fb1d82c37e5d"
    }
  ],
  "blocking_issues": [],
  "checkpoint_sha256": "defecae9ced71607eddedd2632c1f991bce73cd5ac70edf5b111804a0bc468d8",
  "completed_work_units": [
    "fix-issues"
  ],
  "created_at": "2026-07-09T20:22:56.245643Z",
  "dispatch_id": "DSP-9381a25f9e3f12266115",
  "improvement_observations": [],
  "nonce": "NONCE-5db1d45b719dcbd18b3e",
  "proposed_jobs": [],
  "schema_version": 3,
  "status": "completed",
  "summary": "Fixed verification findings"
}
