{
  "acceptance_evidence": [
    "Review findings documented"
  ],
  "artifacts": [
    {
      "path": "report.md",
      "purpose": "worker report",
      "sha256": "cb8524cee1c830121ceee4d4285a8e8e500c38439c7b4db042ae95a6845ad860"
    },
    {
      "path": "checkpoint.md",
      "purpose": "current checkpoint",
      "sha256": "ae7266b8f5d24b32f3b79288268dec8a735e752f7820be1a7b1dbd1a5b4be9b7"
    },
    {
      "path": "progress.json",
      "purpose": "machine-readable progress",
      "sha256": "ff1073e0ea7a3fa030aaf93a29010baabb46d81cfc44b30483da89fee9dbd2bd"
    }
  ],
  "blocking_issues": [],
  "checkpoint_sha256": "ae7266b8f5d24b32f3b79288268dec8a735e752f7820be1a7b1dbd1a5b4be9b7",
  "completed_work_units": [
    "investigate"
  ],
  "created_at": "2026-07-09T21:10:43.473319Z",
  "dispatch_id": "DSP-ea481266111bbb972a3f",
  "improvement_observations": [],
  "nonce": "NONCE-c61db04342efeb4bda91",
  "proposed_jobs": [],
  "schema_version": 3,
  "status": "completed",
  "summary": "Architecture review complete"
}
