{
  "acceptance_evidence": [
    "Git commit and push successful"
  ],
  "artifacts": [
    {
      "path": "report.md",
      "purpose": "worker report",
      "sha256": "bd9827920b6cc5dfccd5f30d0e3689820452d41d2008cf37a573716b1e2a6ef2"
    },
    {
      "path": "checkpoint.md",
      "purpose": "current checkpoint",
      "sha256": "f902c51e861ab42edc2a2ea89b59382c001ef14eb2caffc18dd1e4ce0df12ff5"
    },
    {
      "path": "progress.json",
      "purpose": "machine-readable progress",
      "sha256": "9fc5f98578bd2fbfe5d3275756f00709f0e5ccb2a53c5d0c5f521355d2cd9e1f"
    }
  ],
  "blocking_issues": [],
  "checkpoint_sha256": "f902c51e861ab42edc2a2ea89b59382c001ef14eb2caffc18dd1e4ce0df12ff5",
  "completed_work_units": [
    "commit"
  ],
  "created_at": "2026-07-09T21:01:06.620990Z",
  "dispatch_id": "DSP-17b584c7c4aa7fd6cb1f",
  "improvement_observations": [],
  "nonce": "NONCE-48ae2194e56cfd79e842",
  "proposed_jobs": [],
  "schema_version": 3,
  "status": "completed",
  "summary": "Changes committed and pushed"
}
