{
  "acceptance_evidence": [
    "Verification findings documented"
  ],
  "artifacts": [
    {
      "path": "report.md",
      "purpose": "worker report",
      "sha256": "b59233fa217314b931c2ceee4d77c4fe794f8c9aefb150a9966407090400389e"
    },
    {
      "path": "checkpoint.md",
      "purpose": "current checkpoint",
      "sha256": "4be69307c6d14528d762b8ff8594c4a82b2dc7755281e988e8c55820cde8c216"
    },
    {
      "path": "progress.json",
      "purpose": "machine-readable progress",
      "sha256": "5c97d5ea38f30724d6c874e0e347ce758783d5999a0d65961b6f0053939f57d9"
    }
  ],
  "blocking_issues": [],
  "checkpoint_sha256": "4be69307c6d14528d762b8ff8594c4a82b2dc7755281e988e8c55820cde8c216",
  "completed_work_units": [
    "verify-change"
  ],
  "created_at": "2026-07-09T20:16:11.218671Z",
  "dispatch_id": "DSP-a6b62540f54c01aeaa87",
  "improvement_observations": [],
  "nonce": "NONCE-7c375702405c5dee8669",
  "proposed_jobs": [],
  "schema_version": 3,
  "status": "completed",
  "summary": "Verification complete: all 49 tasks completed. Implementation matches specs with minor deviations: temperature-to-color mapping not in shader, merger flash intensity scaling linear, scrubbing does not pause simulation."
}
