{
  "acceptance_evidence": [
    "Audio, touch, loading, post-processing, error handling, accessibility implemented"
  ],
  "artifacts": [
    {
      "path": "report.md",
      "purpose": "worker report",
      "sha256": "bd9827920b6cc5dfccd5f30d0e3689820452d41d2008cf37a573716b1e2a6ef2"
    },
    {
      "path": "checkpoint.md",
      "purpose": "current checkpoint",
      "sha256": "b7f822163ca791a26f5b19772ada96487e0c5cd78bea83d88184a48f171a41a1"
    },
    {
      "path": "progress.json",
      "purpose": "machine-readable progress",
      "sha256": "d31f78f9ec0efe0cef5f7c19e0dd0cd9494738770ae86f69d7c2d24736ec08dc"
    }
  ],
  "blocking_issues": [],
  "checkpoint_sha256": "b7f822163ca791a26f5b19772ada96487e0c5cd78bea83d88184a48f171a41a1",
  "completed_work_units": [
    "apply-all"
  ],
  "created_at": "2026-07-09T20:46:24.872596Z",
  "dispatch_id": "DSP-907896cd098a49edd974",
  "improvement_observations": [],
  "nonce": "NONCE-f50955fe297919ae1d10",
  "proposed_jobs": [],
  "schema_version": 3,
  "status": "completed",
  "summary": "All audio-polish-04 tasks implemented"
}
